{
  "$schema": "../../schemas/document-field-map.schema.json",
  "schema_version": "1.0.0",
  "map_id": "ghre-rla-document-field-map",
  "contract_type": "Residential Lease Agreement",
  "registry_ref": "../../field-maps/contract-field-registry.json",
  "mappings": [
    {
      "source_variable": "lease_number",
      "business_meaning": "Stable human-readable lease identifier.",
      "registry_field_id": "lease_number",
      "zoho_api_name": null,
      "api_name_status": "tenant_verification_required",
      "source_system": "Zoho CRM approved Lease record",
      "snapshot_behavior": "freeze_at_generation",
      "status": "approved_pending_live_metadata",
      "gate_id": "tenant_field_api_metadata",
      "document_locations": [
        "cover.lease_number"
      ]
    },
    {
      "source_variable": "landlord_name",
      "business_meaning": "Landlord organization name.",
      "registry_field_id": "party_a_name",
      "zoho_api_name": null,
      "api_name_status": "tenant_verification_required",
      "source_system": "Zoho Contracts Party A",
      "snapshot_behavior": "freeze_at_generation",
      "status": "approved_pending_live_metadata",
      "gate_id": "tenant_field_api_metadata",
      "document_locations": [
        "cover.landlord",
        "section_1_1",
        "ending_text.landlord_label"
      ]
    },
    {
      "source_variable": "premises_street",
      "business_meaning": "Property street address execution snapshot.",
      "registry_field_id": "property_address_line_1_snapshot",
      "zoho_api_name": null,
      "api_name_status": "tenant_verification_required",
      "source_system": "Zoho CRM Property record",
      "snapshot_behavior": "freeze_at_generation",
      "status": "approved_pending_live_metadata",
      "gate_id": "tenant_field_api_metadata",
      "document_locations": [
        "cover.premises",
        "section_1_2"
      ]
    },
    {
      "source_variable": "premises_unit",
      "business_meaning": "Property unit identifier execution snapshot.",
      "registry_field_id": "property_unit_number_snapshot",
      "zoho_api_name": null,
      "api_name_status": "tenant_verification_required",
      "source_system": "Zoho CRM Unit record",
      "snapshot_behavior": "freeze_at_generation",
      "status": "approved_pending_live_metadata",
      "gate_id": "tenant_field_api_metadata",
      "document_locations": [
        "cover.premises",
        "section_1_2"
      ]
    },
    {
      "source_variable": "premises_city",
      "business_meaning": "Property city execution snapshot.",
      "registry_field_id": "property_city_snapshot",
      "zoho_api_name": null,
      "api_name_status": "tenant_verification_required",
      "source_system": "Zoho CRM Property record",
      "snapshot_behavior": "freeze_at_generation",
      "status": "approved_pending_live_metadata",
      "gate_id": "tenant_field_api_metadata",
      "document_locations": [
        "cover.premises",
        "section_1_2"
      ]
    },
    {
      "source_variable": "premises_state",
      "business_meaning": "Property state execution snapshot.",
      "registry_field_id": "property_state_code_snapshot",
      "zoho_api_name": null,
      "api_name_status": "tenant_verification_required",
      "source_system": "Zoho CRM Property record",
      "snapshot_behavior": "freeze_at_generation",
      "status": "approved_pending_live_metadata",
      "gate_id": "tenant_field_api_metadata",
      "document_locations": [
        "cover.premises",
        "section_1_2"
      ]
    },
    {
      "source_variable": "premises_postal_code",
      "business_meaning": "Property postal-code execution snapshot.",
      "registry_field_id": "property_postal_code_snapshot",
      "zoho_api_name": null,
      "api_name_status": "tenant_verification_required",
      "source_system": "Zoho CRM Property record",
      "snapshot_behavior": "freeze_at_generation",
      "status": "approved_pending_live_metadata",
      "gate_id": "tenant_field_api_metadata",
      "document_locations": [
        "cover.premises",
        "section_1_2"
      ]
    },
    {
      "source_variable": "tenant_1_name",
      "business_meaning": "Tenant 1 name snapshot when Party B is expressly Tenant 1.",
      "registry_field_id": "party_b_name",
      "zoho_api_name": null,
      "api_name_status": "tenant_verification_required",
      "source_system": "Zoho Contracts Party B",
      "snapshot_behavior": "freeze_at_generation",
      "status": "approved_pending_role_and_metadata_verification",
      "gate_id": "tenant_field_api_metadata",
      "document_locations": [
        "cover.tenant_1",
        "ending_text.tenant_1_printed_name"
      ]
    },
    {
      "source_variable": "agreement_effective_date",
      "business_meaning": "Date the contract becomes active, not a signature date.",
      "registry_field_id": "agreement_effective_date",
      "zoho_api_name": null,
      "api_name_status": "tenant_verification_required",
      "source_system": "Zoho Contracts agreement record",
      "snapshot_behavior": "freeze_at_generation",
      "status": "approved_pending_live_metadata",
      "gate_id": "tenant_field_api_metadata",
      "document_locations": [
        "cover.effective_date"
      ]
    },
    {
      "source_variable": "lease_end_date",
      "business_meaning": "Fixed-term lease expiration date.",
      "registry_field_id": "term_end_date",
      "zoho_api_name": null,
      "api_name_status": "tenant_verification_required",
      "source_system": "Zoho Contracts agreement record",
      "snapshot_behavior": "freeze_at_generation",
      "status": "approved_pending_live_metadata",
      "gate_id": "tenant_field_api_metadata",
      "document_locations": [
        "cover.lease_ends",
        "section_1_3.lease_ends",
        "section_2_1"
      ]
    },
    {
      "source_variable": "monthly_rent",
      "business_meaning": "Monthly Base Rent agreed for the tenancy.",
      "registry_field_id": null,
      "zoho_api_name": null,
      "api_name_status": "tenant_verification_required",
      "source_system": "Owner-approved Zoho CRM Lease snapshot; Zoho Books owns invoices and payment truth",
      "snapshot_behavior": "freeze_at_generation",
      "status": "deferred",
      "gate_id": "monthly_rent_source_ownership",
      "document_locations": [
        "cover.base_rent",
        "section_1_3.base_rent",
        "section_3_2.first_full_month_rent_amount",
        "section_3_2.next_regular_rent_amount",
        "section_3_1"
      ]
    },
    {
      "source_variable": "security_deposit",
      "business_meaning": "Security Deposit amount agreed, not paid or held balance.",
      "registry_field_id": null,
      "zoho_api_name": null,
      "api_name_status": "tenant_verification_required",
      "source_system": "Owner-approved Zoho CRM Lease snapshot; Zoho Books owns liability and refund truth",
      "snapshot_behavior": "freeze_at_generation",
      "status": "deferred",
      "gate_id": "security_deposit_source_ownership",
      "document_locations": [
        "cover.security_deposit",
        "section_1_3.security_deposit",
        "section_3_2.security_deposit",
        "section_4_1"
      ]
    },
    {
      "source_variable": "lease_commencement_date",
      "business_meaning": "Date the lease term and possession period begins.",
      "registry_field_id": null,
      "zoho_api_name": null,
      "api_name_status": "tenant_verification_required",
      "source_system": "Owner-approved Zoho CRM Lease record",
      "snapshot_behavior": "freeze_at_generation",
      "status": "deferred",
      "gate_id": "lease_commencement_field",
      "document_locations": [
        "cover.lease_begins",
        "section_1_3.lease_begins",
        "section_2_1"
      ]
    },
    {
      "source_variable": "tenant_2_name",
      "business_meaning": "Tenant 2 verified legal-name snapshot.",
      "registry_field_id": null,
      "zoho_api_name": null,
      "api_name_status": "tenant_verification_required",
      "source_system": "Owner-approved CRM Lease party relationship",
      "snapshot_behavior": "freeze_at_generation",
      "status": "deferred",
      "gate_id": "tenant_two_three_identity_fields",
      "document_locations": [
        "cover.tenant_2",
        "ending_text.tenant_2_printed_name"
      ]
    },
    {
      "source_variable": "tenant_3_name",
      "business_meaning": "Tenant 3 verified legal-name snapshot.",
      "registry_field_id": null,
      "zoho_api_name": null,
      "api_name_status": "tenant_verification_required",
      "source_system": "Owner-approved CRM Lease party relationship",
      "snapshot_behavior": "freeze_at_generation",
      "status": "deferred",
      "gate_id": "tenant_two_three_identity_fields",
      "document_locations": [
        "cover.tenant_3",
        "ending_text.tenant_3_printed_name"
      ]
    },
    {
      "source_variable": "statutory_notice_information",
      "business_meaning": "Manager and owner or authorized notice-agent names and complete physical mailing addresses.",
      "registry_field_id": null,
      "zoho_api_name": null,
      "api_name_status": "tenant_verification_required",
      "source_system": "Owner-approved legal notice configuration",
      "snapshot_behavior": "freeze_at_generation",
      "status": "deferred",
      "gate_id": "statutory_notice_address",
      "document_locations": [
        "section_1_4.notice_table",
        "ending_text.notice_address_confirmed"
      ]
    },
    {
      "source_variable": "utility_responsibilities",
      "business_meaning": "Per-utility tenant, landlord-paid, or separate-allocation responsibility.",
      "registry_field_id": null,
      "zoho_api_name": null,
      "api_name_status": "tenant_verification_required",
      "source_system": "Owner-approved CRM Lease utility schedule",
      "snapshot_behavior": "freeze_at_generation",
      "status": "deferred",